Meal_Id,Name,catagory,description,Veg_Non,Nutrient,Disease,Diet,Price
meal_id150,kerala fish curry,curry,"white fish (cut into cubes), onion, tomato, garlic cloves, fresh green chillies (deseeded), oil, fresh coconut paste, red chilli paste, coriander powder, turmeric powder, salt, whole dry red chillies, black mustard seeds, curry leaves, tamarind extract, water",non-veg,vitamin_a, anemia pregnancy hypertension cancer heart_disease rickets goitre kidney_disease obesity diabeties, alkaline_diet low_fat_diet ketogenic_diet vegan_diet high_protien_diet dash_diet low_carb_diet,22.68
meal_id151,fish andlouse,fish,"white wine and water mix to cover, onion, salt, bay leaf, black pepper corns, olive oil, onion, garlic, tomatoes (peeled and seeded), basil leaves, spring fresh thyme - optional 1 bay leaf, salt and pepper, olive oil, wine vinegar, prepared mustard, salt and pepper, assorted garden herbs ( parsley, basil etc.",non-veg,vitamin_c, anemia pregnancy hypertension cancer heart_disease rickets goitre kidney_disease obesity diabeties, alkaline_diet low_fat_diet ketogenic_diet vegan_diet high_protien_diet dash_diet low_carb_diet,14.280000000000001
meal_id163,red rice vermicelli kheer,rice,"red rice vermicelli / broken sooji / semolina vermicelli, butter, almonds, whole milk, cardamom powder, saffron strands / thread, sugar",veg,carbohydrates, anemia pregnancy cancer scurvy kidney_disease obesity diabeties, alkaline_diet ketogenic_diet vegan_diet high_protien_diet dash_diet,36.4
meal_id91,riceless chicken biryani,rice,"malabar peppercorn, cinnamon stick, green cardamom pods, star anise, cloves, fennel seeds, vermicelli, desi ghee, shahi jeera, bay leaves, green chilli, mint leaves, onion, saffron, garlic paste, salt, chicken (dark meat), ginger paste, turmeric powder, coriander powder, red chilli powder, roma tomatoes (de-seedeed), water",non-veg,vitamin_c, anemia rickets goitre kidney_disease pregnancy, low_fat_diet low_carb_diet vegan_diet hormone_diet high_protien_diet type_a_diet,12.6
meal_id164,green cucumber shots,rice,"english cucumbers, garlic cloves (smashed), romaine lettuce, basil, parsley, cilantro, big lemon, sea salt, olive oil",veg,iron, anemia hypertension scurvy heart_disease goitre kidney_disease pregnancy diabeties, alkaline_diet low_fat_diet vegan_diet high_fiber_diet hormone_diet dash_diet,12.6
meal_id165,thai pineapple rice,rice,"rice, onion, thai ginger , fresh turmeric, curry leaf, lemon grass, coconut milk, salt, hot curry powder, pineapple chunks, oil, water, turmeric powder, fresh pineapple",veg,carbohydrates, obesity diabeties kidney_disease anemia, high_protien_diet vegan_diet dash_diet ketogenic_diet,29.12
meal_id166,green asparagus risotto,rice,"carnaroli rice, vegetable broth, butter, extra virgin olive oil, parmigiano cheese, onion (minced), white wine, salt & pepper",veg,chloride, anemia hypertension scurvy heart_disease goitre kidney_disease pregnancy diabeties, alkaline_diet dash_diet high_fiber_diet hormone_diet,22.400000000000002
meal_id146,goan prawn curry &amp; baked rice canapes,rice,"jeera whole, coriander seeds, kashmiri chilly, garlic, ginger, green chillies, kokum, coconut, onion, tomatoes, coriander, prawns, salt, turmeric powder, garlic paste, asafoetida, refined oil, ginger paste, goan rice, coconut milk, green chillies, fresh coconut, hing, refined oil, coriander leaves, basmati rice, coconut milk, green chillies, coconut milk, coconut, salt, green chillies, curry leaf, lecite",veg,iron, obesity diabeties goitre anemia, low_fat_diet ketogenic_diet low_sodium_diet vegan_diet high_fiber_diet dash_diet,16.8
meal_id167,veg fried rice,rice,"oil, ginger-garlic paste, spring onion, carrot, cabbage, capsicum, salt, soy sauce, vinegar, rice",veg,carbohydrates, obesity cancer diabeties anemia, alkaline_diet ketogenic_diet vegan_diet hormone_diet high_protien_diet dash_diet,15.68
meal_id168,egg and garlic fried rice,rice,"oil, garlic, spring onion , ginger, red chilli , egg, cooked rice, salt, black pepper powder, soya sauce",non-veg,vitamin_a, anemia pregnancy hypertension cancer heart_disease rickets goitre kidney_disease obesity diabeties, alkaline_diet low_fat_diet ketogenic_diet low_sodium_diet vegan_diet hormone_diet high_protien_diet dash_diet type_a_diet,20.44
meal_id169,curd rice,rice,"rice, water, curd, milk, carrot, green chilli, ginger, salt, coriander leaves, oil, mustard seeds, chana dal, urad dal, curry leaves, red chilli, hing",veg,iron, obesity diabeties anemia, low_fat_diet ketogenic_diet vegan_diet high_fiber_diet dash_diet,25.76
meal_id170,fried rice with soya chunks,rice,"basmati rice, carrot, capsicum, beans, green peas, ginger, garlic, green chillies, bay leaf, cinnamon sticks, green cardamoms, clove, soya chunks, salt,",veg,iron, anemia cancer kidney_disease obesity diabeties, alkaline_diet low_fat_diet ketogenic_diet vegan_diet high_fiber_diet hormone_diet dash_diet,25.48
meal_id108,cauliflower and chicken biryani,rice,"boneless chicken, biryani masala, yogurt, onions, coconut oil, cauliflower, coconut (diced), onion (diced), peppercorns, cardamoms, cumin seeds, bay leaves, cinnamon, cloves, coconut oil, garam masala, dry chilli flakes, turmeric powder, black peppercorns, cardamom, cinnamon, garlic (crushed), tomato puree, green chillies, fresh ginger (peeled), dry red chilli, salt",non-veg,chloride, anemia cancer rickets goitre kidney_disease pregnancy, low_fat_diet low_carb_diet ketogenic_diet vegan_diet hormone_diet high_protien_diet dash_diet type_a_diet,34.160000000000004
meal_id109,chicken quinoa biryani,rice,"onions, tomato, green chillies(slit open), ginger garlic paste, mint leaves, coriander leaves/cilantro, fresh yogurt/curd(beaten), turmeric powder, chilli powder, salt, chicken (cut into pieces), garam masala powder, ginger garlic paste, yogurt/curd,  chilli powder, coriander powder, salt, oil, cloves, bay leaf , cardamom",non-veg,iron, anemia rickets goitre kidney_disease pregnancy, low_fat_diet low_carb_diet low_sodium_diet vegan_diet high_fiber_diet hormone_diet high_protien_diet dash_diet type_a_diet,12.6
meal_id171,corn pulao,rice,"basmati rice, american corn kernels, olive oil, onion, ginger garlic paste, salt, green chillies, cumin seed, bay leaf, pepper corn, cloves, hot water, coriander leaves, lime juice, bell pepper (sauted and diced), coconut",veg,iron, diabeties goitre, low_fat_diet gluten_free_diet vegan_diet high_fiber_diet high_protien_diet,28.0
meal_id172,zucchini methi pulao,rice,"zucchini, basmati rice, fenugreek (methi), clarified butter (desi ghee), clarified butter (desi ghee), cumin seeds (jeera), asafoetida (heeng), green chilles, ginger, salt",veg,chloride, diabeties goitre, ketogenic_diet,27.16
meal_id173,lemon rice,rice,"cooked basmati rice, oil, asafoetida (heeng), mustard seeds (sarson), curry leaves (kadhi patta), whole red chilli (sabut laal mirch), turmeric powder(haldi), salt, lemon juice, peanuts, urad dal, chana dal, ginger",veg,magnesium, obesity diabeties anemia scurvy, ketogenic_diet vegan_diet high_fiber_diet high_protien_diet dash_diet,31.36
meal_id174,kale channe ki biryani,rice,"black gram (kala chana), basmati rice (soaked for 2 hours), cinnamon, green cardamoms, cloves, ghee, black cardamoms, black peppercorns, bay leaves, onions, green chillies (slit), ginger-garlic paste, coriander powder, turmeric powder, yogurt, fresh mint leaves, fresh coriander leaves, garam masala powder, red chilli powder, salt, cashew nuts, almonds, milk, fresh cream, saffron, ginger, screw pine essence (kewra), browned onions, whole wheat flour dough",veg,calcium, scurvy heart_disease kidney_disease pregnancy diabeties, low_fat_diet ketogenic_diet vegan_diet high_fiber_diet high_protien_diet dash_diet,14.56
meal_id175,chicken paella,rice,"chicken, oil, salt and pepper, paprika powder, chilli flakes, garlic paste, onions, bell peppers, rice, vegetable stock, saffron, peas, olives, parsley, white wine",non-veg,chloride, anemia rickets goitre kidney_disease pregnancy, low_fat_diet low_carb_diet vegan_diet hormone_diet high_protien_diet type_a_diet,19.88
meal_id176,thai fish curry,rice,"fish (cubed), thai green curry paste, oil, onions, garlic, ginger/galangal, coconut milk, coriander, lemon juice, palm sugar, basil leaves, salt & pepper",non-veg,vitamin_a, anemia pregnancy hypertension cancer heart_disease rickets goitre kidney_disease obesity diabeties, alkaline_diet low_fat_diet ketogenic_diet vegan_diet high_protien_diet dash_diet low_carb_diet,37.24
meal_id46,steam bunny chicken bao,bread,"buns, all purpose white flour, dry yeast, sugar, salt, warm water, chicken mince, eggs, soy sauce, sugar, sesame oil, worcestershire sauce, chives, aromat powder",non-veg,iron, anemia rickets goitre kidney_disease pregnancy, low_fat_diet low_carb_diet vegan_diet high_fiber_diet hormone_diet high_protien_diet type_a_diet,36.12
meal_id49,christmas tree pizza,bread,"pizza dough (2 boules), red pepper, red onion, basil pesto (purchased, homemade or vegan pesto), mozzarella cheese, kosher salt",veg,chloride, goitre, vegan_diet high_fiber_diet,33.6
meal_id184,vegetable bruschetta,bread,"baguette (grilled slices), black olive tapenade, artichoke hearts, lettuce arugula (trummed), tomato confit, fresh basil leaves, mint leaves, zucchini, goat cheese, parmesan cheese shavings, mozzarella buffalo cheese",veg,calcium, obesity scurvy kidney_disease heart_disease, low_fat_diet ketogenic_diet low_sodium_diet gluten_free_diet vegan_diet high_fiber_diet high_protien_diet,33.32
meal_id29,spinach and feta crepes,bread,"milk (whole fat or skimmed), flour, water, butter, honey, salt, vegetable oil, extra butter (for crisping the crepe), spinach, feta cheese (crumbled), greek yogurt (whisked), honey",veg,vitamin_c, anemia scurvy goitre kidney_disease, dash_diet high_fiber_diet type_a_diet ketogenic_diet,26.04
meal_id185,red wine braised mushroom flatbread,wine,"olive oil, fresh buffalo mozzarella cheese, canned pelati tomatoes (cooked), pizza/flatbread base, mushrooms, red wine, parsley, garlic cloves (halved), salt",veg,vitamin_c, anemia pregnancy cancer scurvy kidney_disease obesity diabeties, alkaline_diet dash_diet low_fat_diet,32.480000000000004
meal_id186,strawberry &amp; pistachio breton tart,bread,"plain flour, baking powder, sea salt, unsalted butter, egg yoks, castor sugar, double cream, yolk, sugar, gelatine, butter, pistachio paste, strawberry",veg,vitamin_a, scurvy kidney_disease, high_protien_diet low_fat_diet,34.72
meal_id187,tricolour pizza,bread,"pizza base , pizza sauce, mozzarella cheese, black olive, green capsicum, carrots, olive oil",veg,sodium, goitre, vegan_diet,21.28
meal_id188,instant rava dosa,bread,"rava/suji/semolina, rice flour, all purpose flour, fresh coconut (pieces), jeera, green chilli, dhaniya, onion (diced), salt, water, oil, ghee/clarified butter",veg,iron, rickets, vegan_diet low_fat_diet high_fiber_diet,20.72
meal_id189,easy bread poha,bread,"oil, hing, mustard seeds, curry leaves, whole red chillies, cookes peas, peanuts, turmeric powder, salt, bread, green chillies, lemon juice, coriander leaves, dessicated coconut",veg,iron, hypertension heart_disease eye_disease rickets goitre obesity, low_fat_diet Mediterranean_diet ketogenic_diet vegan_diet high_fiber_diet high_protien_diet dash_diet,31.92
meal_id190,bread chana basket,bread,"bread (white/brown), butter, for chana chaat:, chana, onion, tomatoes, cumin seeds, ginger garlic paste, chilli powder, chana masala, turmeric powder , oil, salt",veg,chloride, heart_disease, dash_diet Mediterranean_diet,33.6
meal_id191,spaghetti with clams &amp; crispy bread crumbs,bread,"panko, 1/4 cup plus 1 tablespoon extra-virgin olive oil, plus more for drizzling, kosher salt, freshly ground pepper,  garlic cloves,  manila clams or cockles, scrubbed, dry white wine,  spaghetti,  lemon zest,  lemon juice,  mullet bottarga (optional; see note),   red pepper,  thyme,  rosemary,  parsley",veg,iron, heart_disease, low_fat_diet Mediterranean_diet ketogenic_diet vegan_diet high_fiber_diet dash_diet,30.240000000000002
meal_id192,kasha bread,bread,"kasha, boiling water, buckwheat flour, all-purpose gluten free flour, brown sugar, baking powder, baking soda, xanthum gum, salt, buttermilk, cream, egg, oil, walnuts",veg,selenium, heart_disease, low_fat_diet Mediterranean_diet ketogenic_diet vegan_diet dash_diet,29.400000000000002
meal_id193,egg paratha,bread,"whole wheat flour, salt, oil, eggs, onions, green chilli, coriander leaves, garam masala",non-veg,vitamin_a, hypertension rickets goitre kidney_disease pregnancy diabeties, low_sodium_diet high_protien_diet low_fat_diet ketogenic_diet,21.0
meal_id194,egg and cheddar cheese sandwich,bread,"egg, salt, pepper, ham slices, basil leaves",non-veg,vitamin_a, pregnancy hypertension eye_disease rickets goitre kidney_disease obesity diabeties, alkaline_diet low_fat_diet ketogenic_diet low_sodium_diet vegan_diet high_protien_diet dash_diet,32.76
meal_id195,egg in a blanket,bread,"eggs, brown bread slices, butter, chilli flakes, oregano, salt",non-veg,vitamin_a, hypertension rickets goitre kidney_disease pregnancy diabeties, low_sodium_diet high_protien_diet low_fat_diet ketogenic_diet,13.16
meal_id196,bread dahi vada,bread,"bread slices, curd, oil, salt and black pepper , red chilli powder, aamchoor powder, mint leaves, zeera powder, anardana",veg,chloride, heart_disease, dash_diet Mediterranean_diet,25.2
meal_id43,beetroot modak,modak,"gram flour (besan), semolina (rava/sooji), beetroot colour or two oven cooked beetroot paste , water, oil (for frying), for sugar syrup:, sugar, water, cardamom powder, lemon juice, cashews (kaju)",veg,selenium, hypertension, vegan_diet low_fat_diet ketogenic_diet,27.16
meal_id62,active charcoal modak,modak,"for modak:, gram flour (besan), semolina (rava/suji), active charcoal, water, oil (for frying), sugar, water, cardamom powder, lemon juice, cashews (kaju)",veg,selenium, obesity diabeties, vegan_diet low_fat_diet ketogenic_diet hormone_diet,21.0
meal_id63,flax seed and beetroot modak,modak,"rice flour, salt, oil (for greasing), beetroot puree, tossed flax seeds (for topping), fresh coconut, jaggery, poppy seeds, green cardamom powder, nutmeg powder",veg,magnesium, goitre hypertension heart_disease, high_protien_diet vegan_diet high_fiber_diet,17.64
meal_id199,lemon poppy seed cake,cake,"plain flour, baking powder, salt, castor sugar, baking soda, eggs, butter, vanilla essence, lemon juice, poppy seed, lemon peel, to serve:, lemon syrup, whip cream, fresh berry",veg,potassium, scurvy, high_protien_diet low_fat_diet high_fiber_diet ketogenic_diet,21.28
meal_id64,chocolate prunes gujiyas,chocolate,"for gujiya pastry:, refined flour, ghee, water, salt, for gujiya stuffing:, dark chocolate, prunes, mawa, sugar, cardamom",veg,magnesium, hypertension heart_disease, high_protien_diet high_fiber_diet ketogenic_diet,26.6
meal_id65,almond &amp; white chocolate gujiya,gujiya,"all-purpose flour, clarified butter (ghee), water, white chocolate, dessicated coconut, green cardamom powder, almond, jaggery",veg,magnesium, anemia hypertension scurvy heart_disease rickets kidney_disease obesity, low_fat_diet omni_diet ketogenic_diet gluten_free_diet high_fiber_diet hormone_diet high_protien_diet,14.280000000000001
meal_id68,gajar halwa tart,halwa,"white butter, breakfast sugar, milk full fat, refined flour, winter carrots, ghee, sugar, khoya, cardamom powder, cashew nuts (crushed), almonds (crushed), full fat milk, full fat milk, grain sugar, green cardamom powder",veg,vitamin_d, kidney_disease, low_fat_diet,11.48
meal_id51,christmas chocolate fudge cookies,cookie,"unsalted butter, brown sugar, chocolate, chocolate chips, eggs, flour, cocoa powder, baking powder",veg,magnesium, hypertension heart_disease, high_protien_diet high_fiber_diet ketogenic_diet,36.68
meal_id5,gluten-free christmas cake,cake,"christmas dry fruits (pre-soaked), orange zest, lemon zest, jaggery syrup, almond flour, apple, butter (softened), eggs",veg,vitamin_a, goitre kidney_disease, high_protien_diet,11.48
meal_id53,chocolate appo,chocolate,"rice, coconut, baking powder, vanilla extract, cinnamon powder, brown sugar, unsweetened cocoa powder, salt, chocolate chips, butter",veg,magnesium, hypertension heart_disease, high_protien_diet high_fiber_diet ketogenic_diet,14.0
meal_id163,red rice vermicelli kheer,kheer,"red rice vermicelli / broken sooji / semolina vermicelli, butter, almonds, whole milk, cardamom powder, saffron strands / thread, sugar",veg,carbohydrates, anemia pregnancy cancer scurvy kidney_disease obesity diabeties, alkaline_diet ketogenic_diet vegan_diet high_protien_diet dash_diet,19.04
meal_id200,chocolate kaju katli,kaju,"cashew nuts, sugar, water, milk chocolate or dark chocolate",veg,vitamin_d, hypertension heart_disease, high_fiber_diet ketogenic_diet,37.24
meal_id56,chocolate samosa,samosa,"refined flour, desi ghee, black cardamom seeds, chocolate block, almonds, cashew nuts, pistachio, sugar, garam masala powder, oil",veg,magnesium, hypertension heart_disease, high_protien_diet high_fiber_diet ketogenic_diet,18.48
meal_id201,mix fruit laccha rabri tortilla crunch,rabri,"milk, sugar, cardamom powder, saffron, almonds and pistachios, grapes, apple, kiwi, orange, pomegranate, mint leaves, tortilla sheet, oil",veg,calcium, pregnancy hypertension scurvy heart_disease eye_disease obesity diabeties, alkaline_diet low_fat_diet ketogenic_diet low_sodium_diet vegan_diet high_fiber_diet hormone_diet high_protien_diet,12.6
meal_id24,green lentil dessert fudge,dessert,"whole moong beans, cow ghee, raisins, whole milk, jaggery (organic), ground cardamom, almonds (halved)",veg,calcium, anemia hypertension scurvy heart_disease goitre kidney_disease pregnancy diabeties, alkaline_diet low_fat_diet ketogenic_diet vegan_diet high_fiber_diet hormone_diet high_protien_diet dash_diet,14.84
meal_id44,andhra pan fried pomfret,curry,"white pomfret fish, sunflower refined ooil, red chilli powder, salt, turmeric powder, ginger-garlic paste, lemon (juiced), cumin powder, coriander powder, garam masala, green chilli, curry leaves, coriander",veg,iron, cancer, alkaline_diet low_fat_diet vegan_diet high_fiber_diet hormone_diet,17.92
meal_id126,andhra crab meat masala,crab,"processed crab meat, refined oil, curry leaves, garlic, green chilli, onion, ginger-garlic paste, coriander, coriander powder, cumin powder, turmeric powder, garam masala powder, kashmiri chilli powder, salt, lemon, chop masala, tomato",non-veg,potassium, anemia pregnancy cancer kidney_disease obesity, type_o_diet low_fat_diet omni_diet ketogenic_diet low_sodium_diet vegan_diet high_fiber_diet high_protien_diet dash_diet,11.200000000000001
meal_id136,malabari fish curry,curry,"sear fish, coconut, ginger, pureed tamarind, salt, powdered turmeric, green chillies, red chilli powder, shallots",non-veg,vitamin_a, anemia pregnancy hypertension cancer heart_disease rickets goitre kidney_disease obesity diabeties, alkaline_diet low_fat_diet ketogenic_diet vegan_diet high_protien_diet dash_diet low_carb_diet,37.24
meal_id45,ghee roast chicken dosa quesadilla,dosa,"dry red chillies, coriander seeds, cumin seeds, fenugreek seeds, black pepper, clove, garlic, turmeric powder, boneless chicken, curd, lemon (juiced), for cooking chicken:, tamarind pulp, ginger (1 inch), garlic cloves, onion, tomato, ghee, red chilli powder, salt, crushed jaggery, dosa batter (for 4 dosas), processed cheese, ghee or oil (to crisp the dosa), coriander leaves, curry leaves (deep fried), curd, salt, zeera powder, sugar, red chilli powder",non-veg,iron, anemia rickets goitre kidney_disease pregnancy, low_fat_diet low_carb_diet vegan_diet high_fiber_diet hormone_diet high_protien_diet type_a_diet,21.56
meal_id2,chicken minced salad,salad,"olive oil, chicken mince, garlic (minced), onion, salt, black pepper, carrot, cabbage, green onions, sweet chilli sauce, peanut butter, ginger, soy sauce, fresh cilantro, red pepper flakes (crushed), tarts",non-veg,fiber, anemia pregnancy hypertension rickets goitre kidney_disease obesity, low_fat_diet low_carb_diet ketogenic_diet low_sodium_diet vegan_diet high_fiber_diet hormone_diet high_protien_diet type_a_diet,28.0
meal_id46,steam bunny chicken bao,bao,"buns, all purpose white flour, dry yeast, sugar, salt, warm water, chicken mince, eggs, soy sauce, sugar, sesame oil, worcestershire sauce, chives, aromat powder",non-veg,iron, anemia rickets goitre kidney_disease pregnancy, low_fat_diet low_carb_diet vegan_diet high_fiber_diet hormone_diet high_protien_diet type_a_diet,38.08
meal_id211,lamb barley pot,barley,"pot barley, onions, worcestershire sauce, chilli flakes, mustard seeds, thick mutton chunks, thick neck of lamb chops, water or stock (to cover), salt, black pepper (freshly ground)",non-veg,iron, goitre, vegan_diet low_fat_diet high_fiber_diet,19.88
meal_id65,almond &amp; white chocolate gujiya,gujiya,"all-purpose flour, clarified butter (ghee), water, white chocolate, dessicated coconut, green cardamom powder, almond, jaggery",veg,magnesium, anemia hypertension scurvy heart_disease rickets kidney_disease obesity, low_fat_diet omni_diet ketogenic_diet gluten_free_diet high_fiber_diet hormone_diet high_protien_diet,30.8
meal_id212,al hachi chicken,chicken,"shallow fried chicken, bottle gourd (boiled and sun dried), onion, garlic, whole spices:, green cardamom, black cardamom, cinnamon sticks, turmeric, deggi mirch, fennel seeds powder, dry ginger powder, coriander powder, salt, mustard oil, desi ghee",non-veg,magnesium, anemia rickets goitre kidney_disease pregnancy, low_fat_diet low_carb_diet vegan_diet high_fiber_diet hormone_diet high_protien_diet type_a_diet,20.16
meal_id48,almond and chicken momos (without shell),chicken,"chicken mince, garlic, carrots, spring onion, ginger, soya sauce, oyster sauce, sesame oil, pepper powder, egg, almonds (blanched), oil (for greasing)",non-veg,calcium, anemia hypertension rickets goitre kidney_disease pregnancy, low_fat_diet low_carb_diet ketogenic_diet low_sodium_diet gluten_free_diet vegan_diet high_fiber_diet hormone_diet high_protien_diet type_a_diet,25.76
meal_id213,berry parfait hazelnut white chocolate sable,chocolate,"for berry parfait:, egg yolk, caster sugar, berry puree, cream cheese, double cream, for hazelnut streusel:, ground hazelnut, flour, caster sugar, butter, for hazelnut white chocolate pressed sable:, hazelnut streusel, cocoa butter, puffed rice, clarified butter, melted white chocolate, for flexy berry:, raspberry puree, sugar, liquid glucose, pectin",veg,vitamin_a, anemia hypertension scurvy heart_disease rickets kidney_disease obesity, low_fat_diet omni_diet ketogenic_diet high_fiber_diet hormone_diet high_protien_diet,14.0
meal_id49,christmas tree pizza,pizza,"pizza dough (2 boules), red pepper, red onion, basil pesto (purchased, homemade or vegan pesto), mozzarella cheese, kosher salt",veg,chloride, goitre, vegan_diet high_fiber_diet,26.04
meal_id137,portugese fish stew,fish,"sole fillet (you can also do 2/3 types of fish), large shrimps (optional), potatoes (peeled), onions (cut into slices), garlic cloves, red capsicum (can use green also), parsley or coriander (choose the herb that most suits your taste buds), few dashes of hot sauce, paprika, olive oil, white wine, rock salt",non-veg,vitamin_a, anemia pregnancy hypertension cancer heart_disease rickets goitre kidney_disease obesity diabeties, alkaline_diet low_fat_diet ketogenic_diet vegan_diet high_protien_diet dash_diet low_carb_diet,26.04
meal_id127,cajun spiced turkey wrapped with bacon,wrapped,"turkey breast, cajun spice, spinach leaves (cooked and drained), garlic pods, salted butter, feta cheese, bacon strips, ground black pepper, for cajun spice:, onion powder, garlic powder, seasoning salt, paprika, ground black pepper, cayenne pepper, oregano, thyme, red pepper flakes (if you like it spicy))",non-veg,vitamin_c, cancer, high_protien_diet,35.56
meal_id213,berry parfait hazelnut white chocolate sable,chocolate,"for berry parfait:, egg yolk, caster sugar, berry puree, cream cheese, double cream, for hazelnut streusel:, ground hazelnut, flour, caster sugar, butter, for hazelnut white chocolate pressed sable:, hazelnut streusel, cocoa butter, puffed rice, clarified butter, melted white chocolate, for flexy berry:, raspberry puree, sugar, liquid glucose, pectin",veg,vitamin_a, anemia hypertension scurvy heart_disease rickets kidney_disease obesity, low_fat_diet omni_diet ketogenic_diet high_fiber_diet hormone_diet high_protien_diet,19.04
meal_id50,belgian pork chop,chop,"pork chop, pink pepper corn, green pepper corn, aromatic sauce, salt, black pepper, salted butter, refined oil, red cabbage, bell pepper chop, apricot, onion, red wine, ancho chilli, cayenne pepper, microgreen",veg,iron, pregnancy goitre, low_fat_diet paleo_diet vegan_diet high_fiber_diet high_protien_diet,35.84
meal_id186,strawberry &amp; pistachio breton tart,strawberry,"plain flour, baking powder, sea salt, unsalted butter, egg yoks, castor sugar, double cream, yolk, sugar, gelatine, butter, pistachio paste, strawberry",veg,vitamin_a, scurvy kidney_disease, high_protien_diet low_fat_diet,37.800000000000004
meal_id216,duo of chocolate and strawberry,strawberry,"dark chocolate, white chocolate, strawberries",veg,vitamin_c, scurvy hypertension heart_disease, high_fiber_diet ketogenic_diet,12.32
meal_id217,mustard-parmesan whole roasted cauliflower,roasted,"cauliflowers, garlic, halved, olive oil , dijon mustard , kosher salt , freshly ground black pepper , fresh parsley leaves, parmesan , lemon wedges",veg,chloride, cancer hypertension kidney_disease, alkaline_diet ketogenic_diet vegan_diet high_protien_diet dash_diet,28.560000000000002
