Meal_Id,Name,catagory,description,Veg_Non,Nutrient,Disease,Diet,Price
meal_id1,summer squash salad,salad,"white balsamic vinegar, lemon juice, lemon rind, red chillies, garlic cloves (crushed), olive oil, summer squash (zucchini), sea salt, black pepper, basil leaves",veg,fiber, obesity diabeties hypertension goitre, alkaline_diet low_fat_diet ketogenic_diet low_sodium_diet high_fiber_diet high_protien_diet dash_diet,27.16
meal_id2,chicken minced salad,salad,"olive oil, chicken mince, garlic (minced), onion, salt, black pepper, carrot, cabbage, green onions, sweet chilli sauce, peanut butter, ginger, soy sauce, fresh cilantro, red pepper flakes (crushed), tarts",non-veg,fiber, anemia pregnancy hypertension rickets goitre kidney_disease obesity, low_fat_diet low_carb_diet ketogenic_diet low_sodium_diet vegan_diet high_fiber_diet hormone_diet high_protien_diet type_a_diet,33.6
meal_id3,sweet chilli almonds,chilli,"almonds whole, egg white, curry leaves, salt, sugar (fine grain), red chilli powder",veg,vitamin_a, hypertension scurvy heart_disease goitre kidney_disease pregnancy, alkaline_diet low_fat_diet paleo_diet Mediterranean_diet low_sodium_diet high_fiber_diet high_protien_diet dash_diet,14.280000000000001
meal_id4,tricolour salad,salad,"vinegar, honey/sugar, soy sauce, salt, garlic cloves (minced), chilli pepper (sliced), green papaya, carrot (peeled), cucumbers, mint leaves, toasted peanuts",veg,fiber, obesity goitre hypertension, low_fat_diet ketogenic_diet low_sodium_diet high_fiber_diet high_protien_diet,34.44
meal_id5,gluten-free christmas cake,cake,"christmas dry fruits (pre-soaked), orange zest, lemon zest, jaggery syrup, almond flour, apple, butter (softened), eggs",veg,vitamin_a, goitre kidney_disease, high_protien_diet,26.04
meal_id6,japanese curry arancini with  barley salsa,barley,"japanese curry, sticky rice, cheese inside rice, barley salsa, wasabi mayo, red capsicum cube (cut), yellow capsicum cube (cut), green capsicum cube (cut), green chily, barley, butter, white pepper, light soya, salt",veg,calcium, goitre, high_protien_diet vegan_diet low_fat_diet ketogenic_diet,35.28
meal_id7,chocolate nero cookies,cookie,"almonds, eggs, granulated sugar, bittersweet chocolate, unsalted butter, flour, baking powder, castor sugar, icing sugar",veg,magnesium, hypertension heart_disease, high_protien_diet high_fiber_diet ketogenic_diet,26.6
meal_id8,lamb and chargrilled bell pepper soup,soup,"lamb bones (preferably shank and shoulder), onions, celery, ginger, garlic, carrot, chargrilled red/yellow/green bell peppers (quartered), whole spices mix (black pepper, cinnamon, cardamom, clove, bay leaf), salt, water (warm), oil (sunflower or olive",non-veg,sodium, pregnancy scurvy goitre kidney_disease obesity, alkaline_diet,19.04
meal_id9,cream of almond soup,soup,"vegetable stock, skimmed milk, toasted almonds (powdered), butter, flour, salt and pepper, nutmeg, almond essence, toasted almond flakes",veg,calcium, obesity cancer hypertension, alkaline_diet low_fat_diet ketogenic_diet gluten_free_diet vegan_diet high_protien_diet,16.240000000000002
meal_id10,broccoli and almond soup,soup,"vegetable stock, broccoli, ground almonds (toasted), skimmed milk, salt, freshly ground black pepper",veg,vitamin_c, pregnancy hypertension scurvy obesity diabeties, alkaline_diet ketogenic_diet gluten_free_diet vegan_diet high_protien_diet dash_diet,28.84
meal_id11,coconut lime quinoa salad,salad,"uncooked quinoa, water, red onion, cucumber (diced), purple cabbage, avocado (ripened and diced), orange, shelled edamame (defrosted), unsweetened toasted coconut flakes, almonds, few shakes of black pepper, for the dressing:, orange juice, lime (juiced), apple cider vinegar, olive oil",veg,fiber, pregnancy hypertension scurvy goitre obesity, alkaline_diet low_fat_diet paleo_diet ketogenic_diet low_sodium_diet gluten_free_diet vegan_diet high_fiber_diet high_protien_diet dash_diet,30.240000000000002
meal_id12,lemon honey glazed sous vide corn on the cob,corn,"young corn on the cob, honey, lemon juice, garlic cloves (smashed), celery stalk, chives, carrot, salt, paprika powder, parsley, plastic bag, food thermometer",non-veg,protien, diabeties goitre scurvy, low_fat_diet gluten_free_diet high_fiber_diet high_protien_diet dash_diet,17.36
meal_id13,watermelon and strawberry smoothie,smoothie,"fresh strawberries, honey, low fat yogurt, watermelon, chia seeds",veg,magnesium, scurvy, high_protien_diet high_fiber_diet,26.6
meal_id14,"peach, raspberry and nuts smoothie",smoothie,"fresh raspberries, ripe banana, almond, fresh peach slices, low fat yogurt, fresh raspeberry, peach fruit slices, almonds",veg,vitamin_e, anemia cancer heart_disease kidney_disease obesity diabeties, alkaline_diet omni_diet ketogenic_diet low_sodium_diet vegan_diet high_fiber_diet gluten_free_diet,32.76
meal_id15,almond and cranberry poha,poha,"almond flakes, onion, poha, cranberries (frozen/ dried), salt, oil, curry leaves, green chilies, fresh coconut",veg,iron, hypertension, gluten_free_diet vegan_diet low_fat_diet high_fiber_diet,24.92
meal_id16,almond and raw banana galawat,banana,"almond slivers, raw banana (boiled), almond paste, cooking cream, refined oil, mace powder, cardamom powder , ginger garlic paste, garam masala powder, red chilli powder, salt, tempura batter",veg,selenium, anemia hypertension cancer scurvy heart_disease kidney_disease diabeties, alkaline_diet low_fat_diet ketogenic_diet gluten_free_diet vegan_diet high_fiber_diet high_protien_diet,22.12
meal_id17,baked namakpara with roasted almond dip,dip,"almonds (crushed), tomato, garlic cloves, basil sprig, lemon, salt, pepper, for namak para:, refined flour, sugar, salt, olive oil, water",veg,calcium, goitre hypertension kidney_disease, alkaline_diet low_fat_diet ketogenic_diet low_sodium_diet gluten_free_diet vegan_diet high_fiber_diet high_protien_diet,23.8
meal_id19,baked shankarpali recipe,shankarpali,"whole wheat flour (atta), refined flour (maida), garlic cloves (crushed), salt, red chilli powder, chaat masala, cumin powder, tomato puree, ghee",veg,carbohydrates, diabeties goitre, alkaline_diet low_fat_diet low_sodium_diet high_fiber_diet high_protien_diet,18.2
meal_id20,baked multigrain murukku,baked,"oats, ragi flour (bhakri atta), wheat flour, rice flour, urad dal flour (dry roast and grind the dal to a fine powder), cumin seeds, green chillies, ginger, salt, oil",veg,iron, goitre, low_sodium_diet vegan_diet low_fat_diet high_fiber_diet,35.56
meal_id22,baked namak para,baked,"whole wheat flour (atta), refined flour (maida), baking powder, ghee, salt, carom seeds (ajwain)",veg,magnesium, goitre, low_sodium_diet high_protien_diet low_fat_diet high_fiber_diet,34.160000000000004
meal_id24,green lentil dessert fudge,dessert,"whole moong beans, cow ghee, raisins, whole milk, jaggery (organic), ground cardamom, almonds (halved)",veg,calcium, anemia hypertension scurvy heart_disease goitre kidney_disease pregnancy diabeties, alkaline_diet low_fat_diet ketogenic_diet vegan_diet high_fiber_diet hormone_diet high_protien_diet dash_diet,11.76
meal_id25,cashew nut cookies,cookie,"cashew paste, ghee, khaand (a sweetening agent and a healthier substitute of sugar), flax or chia seeds, plain yogurt, baking soda, baking powder, vanilla, oats, organic all-purpose flour",veg,protien, hypertension, high_protien_diet vegan_diet dash_diet ketogenic_diet,36.68
meal_id26,almond pearls,almond,"toasted almonds, blueberries, oats, corn flakes, olive oil, salt, curry leaves, mustard seeds, cumin seeds, red chilli powder, turmeric powder, black pepper powder, ajwain, lemon juice",veg,protien, hypertension, gluten_free_diet,30.8
meal_id27,hawaiin papaya salad,salad,"papaya, fresh lime (juiced), watermelon balls or small squares (seedless), fresh pineapple chunks, coconut (unsweetened), vanilla flavoured yogurt (low fat)",veg,fiber, obesity scurvy hypertension goitre, alkaline_diet low_fat_diet ketogenic_diet low_sodium_diet high_fiber_diet high_protien_diet,13.72
meal_id28,vegetable som tam salad,salad,"raw papaya, carrot, french bean diamond, cherry tomato, garlic, crush mix chilli, somtam dressing, peanuts (crushed), peanuts",veg,fiber, hypertension scurvy heart_disease goitre kidney_disease obesity, low_fat_diet ketogenic_diet low_sodium_diet gluten_free_diet vegan_diet high_fiber_diet high_protien_diet,36.68
meal_id29,spinach and feta crepes,spinach,"milk (whole fat or skimmed), flour, water, butter, honey, salt, vegetable oil, extra butter (for crisping the crepe), spinach, feta cheese (crumbled), greek yogurt (whisked), honey",veg,vitamin_c, anemia scurvy goitre kidney_disease, dash_diet high_fiber_diet type_a_diet ketogenic_diet,13.72
meal_id30,couscous with ratatouille - tangy tomato sauce,sauce,"for the cous cous:, plain couscous, extra virgin olive oil, vegetable stock, herbs (basil, parsley, thyme, cilantro work best), for the ratatouille:, olive oil (regular not extra virgin), red onions, aubergines (cut in to 3 cm cubes), zucchini (cut in to 3 cm cubes), garlic cloves, ground cumin, sweet paprika, tomato paste, salt",veg,chloride, anemia pregnancy hypertension cancer scurvy heart_disease eye_disease rickets goitre kidney_disease obesity diabeties, alkaline_diet low_fat_diet ketogenic_diet vegan_diet high_fiber_diet hormone_diet high_protien_diet dash_diet,12.32
meal_id31,baked almond kofta,kofta,"potato (boiled), nutmeg, milk, almonds (crushed), green onions, refined flour, egg, salt, pepper, eggs, refined flour (for rolling), dried breadcrumbs (for rolling)",veg,calcium, goitre hypertension, low_fat_diet ketogenic_diet low_sodium_diet gluten_free_diet vegan_diet high_fiber_diet high_protien_diet,34.160000000000004
meal_id42,sugar free modak,snacks,"seedless dates, almonds, cashew nuts, walnuts, raisins, dry coconut, poppy seeds, ghee",veg,carbohydrates, pregnancy hypertension cancer heart_disease goitre kidney_disease obesity diabeties, low_fat_diet ketogenic_diet gluten_free_diet vegan_diet high_fiber_diet hormone_diet high_protien_diet dash_diet,11.76
meal_id43,beetroot modak,snacks,"gram flour (besan), semolina (rava/sooji), beetroot colour or two oven cooked beetroot paste , water, oil (for frying), for sugar syrup:, sugar, water, cardamom powder, lemon juice, cashews (kaju)",veg,selenium, hypertension, vegan_diet low_fat_diet ketogenic_diet,23.52
meal_id44,andhra pan fried pomfret,snacks,"white pomfret fish, sunflower refined ooil, red chilli powder, salt, turmeric powder, ginger-garlic paste, lemon (juiced), cumin powder, coriander powder, garam masala, green chilli, curry leaves, coriander",veg,iron, cancer, alkaline_diet low_fat_diet vegan_diet high_fiber_diet hormone_diet,36.12
meal_id45,ghee roast chicken dosa quesadilla,snacks,"dry red chillies, coriander seeds, cumin seeds, fenugreek seeds, black pepper, clove, garlic, turmeric powder, boneless chicken, curd, lemon (juiced), for cooking chicken:, tamarind pulp, ginger (1 inch), garlic cloves, onion, tomato, ghee, red chilli powder, salt, crushed jaggery, dosa batter (for 4 dosas), processed cheese, ghee or oil (to crisp the dosa), coriander leaves, curry leaves (deep fried), curd, salt, zeera powder, sugar, red chilli powder",non-veg,iron, anemia rickets goitre kidney_disease pregnancy, low_fat_diet low_carb_diet vegan_diet high_fiber_diet hormone_diet high_protien_diet type_a_diet,38.36
meal_id46,steam bunny chicken bao,snacks,"buns, all purpose white flour, dry yeast, sugar, salt, warm water, chicken mince, eggs, soy sauce, sugar, sesame oil, worcestershire sauce, chives, aromat powder",non-veg,iron, anemia rickets goitre kidney_disease pregnancy, low_fat_diet low_carb_diet vegan_diet high_fiber_diet hormone_diet high_protien_diet type_a_diet,18.76
meal_id47,meat lovers pizza,snacks,"millet flour, tapioca flour, soy milk, garlic powder, baking powder, salt, tomato sauce, mozzarella cheese, prosciutto, pepperoni, chicken salami, salami milano, rosemary, olive oil",non-veg,potassium, anemia pregnancy cancer goitre kidney_disease obesity, type_o_diet low_fat_diet omni_diet ketogenic_diet low_sodium_diet vegan_diet high_fiber_diet high_protien_diet dash_diet,22.68
meal_id48,almond and chicken momos (without shell),snacks,"chicken mince, garlic, carrots, spring onion, ginger, soya sauce, oyster sauce, sesame oil, pepper powder, egg, almonds (blanched), oil (for greasing)",non-veg,calcium, anemia hypertension rickets goitre kidney_disease pregnancy, low_fat_diet low_carb_diet ketogenic_diet low_sodium_diet gluten_free_diet vegan_diet high_fiber_diet hormone_diet high_protien_diet type_a_diet,23.240000000000002
meal_id49,christmas tree pizza,snacks,"pizza dough (2 boules), red pepper, red onion, basil pesto (purchased, homemade or vegan pesto), mozzarella cheese, kosher salt",veg,chloride, goitre, vegan_diet high_fiber_diet,36.96
meal_id50,belgian pork chop,snacks,"pork chop, pink pepper corn, green pepper corn, aromatic sauce, salt, black pepper, salted butter, refined oil, red cabbage, bell pepper chop, apricot, onion, red wine, ancho chilli, cayenne pepper, microgreen",veg,iron, pregnancy goitre, low_fat_diet paleo_diet vegan_diet high_fiber_diet high_protien_diet,12.040000000000001
meal_id51,christmas chocolate fudge cookies,cookie,"unsalted butter, brown sugar, chocolate, chocolate chips, eggs, flour, cocoa powder, baking powder",veg,magnesium, hypertension heart_disease, high_protien_diet high_fiber_diet ketogenic_diet,29.68
meal_id6,japanese curry arancini with  barley salsa,snacks,"japanese curry, sticky rice, cheese inside rice, barley salsa, wasabi mayo, red capsicum cube (cut), yellow capsicum cube (cut), green capsicum cube (cut), green chily, barley, butter, white pepper, light soya, salt",veg,calcium, goitre, high_protien_diet vegan_diet low_fat_diet ketogenic_diet,38.64
meal_id7,chocolate nero cookies,cookie,"almonds, eggs, granulated sugar, bittersweet chocolate, unsalted butter, flour, baking powder, castor sugar, icing sugar",veg,magnesium, hypertension heart_disease, high_protien_diet high_fiber_diet ketogenic_diet,13.72
meal_id52,chicken parmigiana with tomato sauce,snacks,"for chicken parmigiana:, chicken breast, egg whole frozen, flour, planko bread crumbs, fresh italian parsley, vegetable oil, solid butter unsalted, tomato sauce, mozzarella cheese, italian parmesan cheese, thyme, for pepperonata:, red pepper, green pepper, yellow pepper, red onion, fresh tomato, butternut squash, garlic, pure olive oil, vegetable oil, black pepper corn (crushed), salt, parsley, for garnishing:, parsley sprig, spinach",non-veg,vitamin_c, anemia rickets goitre kidney_disease pregnancy, low_fat_diet low_carb_diet vegan_diet hormone_diet high_protien_diet type_a_diet,27.16
meal_id53,chocolate appo,snacks,"rice, coconut, baking powder, vanilla extract, cinnamon powder, brown sugar, unsweetened cocoa powder, salt, chocolate chips, butter",veg,magnesium, hypertension heart_disease, high_protien_diet high_fiber_diet ketogenic_diet,19.04
meal_id12,lemon honey glazed sous vide corn on the cob,snacks,"young corn on the cob, honey, lemon juice, garlic cloves (smashed), celery stalk, chives, carrot, salt, paprika powder, parsley, plastic bag, food thermometer",non-veg,protien, diabeties goitre scurvy, low_fat_diet gluten_free_diet high_fiber_diet high_protien_diet dash_diet,38.36
meal_id54,sous-vide salmon tikka,snacks,"norwegian salmon, black garlic pickle, butter, butchery bag, smoked yogurt, home made prawn crisp, edible flower, salt",non-veg,calcium, anemia pregnancy hypertension heart_disease rickets goitre obesity diabeties, high_protien_diet vegan_diet low_fat_diet ketogenic_diet,26.04
meal_id55,filo pizza,snacks,"filo pastry, himalayan salt, black pepper, salted butter, tomato sauce, broccoli, button mushroom, green zucchini, yellow zucchini, capsicum yellow, capsicum green, capsicum red, pizza spice mix, mozzarella cheese",veg,calcium, goitre, high_protien_diet vegan_diet low_fat_diet ketogenic_diet,33.04
meal_id15,almond and cranberry poha,snacks,"almond flakes, onion, poha, cranberries (frozen/ dried), salt, oil, curry leaves, green chilies, fresh coconut",veg,iron, hypertension, gluten_free_diet vegan_diet low_fat_diet high_fiber_diet,30.240000000000002
meal_id16,almond and raw banana galawat,snacks,"almond slivers, raw banana (boiled), almond paste, cooking cream, refined oil, mace powder, cardamom powder , ginger garlic paste, garam masala powder, red chilli powder, salt, tempura batter",veg,selenium, anemia hypertension cancer scurvy heart_disease kidney_disease diabeties, alkaline_diet low_fat_diet ketogenic_diet gluten_free_diet vegan_diet high_fiber_diet high_protien_diet,22.96
meal_id17,baked namakpara with roasted almond dip,snacks,"almonds (crushed), tomato, garlic cloves, basil sprig, lemon, salt, pepper, for namak para:, refined flour, sugar, salt, olive oil, water",veg,calcium, goitre hypertension kidney_disease, alkaline_diet low_fat_diet ketogenic_diet low_sodium_diet gluten_free_diet vegan_diet high_fiber_diet high_protien_diet,30.8
meal_id56,chocolate samosa,snacks,"refined flour, desi ghee, black cardamom seeds, chocolate block, almonds, cashew nuts, pistachio, sugar, garam masala powder, oil",veg,magnesium, hypertension heart_disease, high_protien_diet high_fiber_diet ketogenic_diet,18.48
meal_id19,baked shankarpali recipe,snacks,"whole wheat flour (atta), refined flour (maida), garlic cloves (crushed), salt, red chilli powder, chaat masala, cumin powder, tomato puree, ghee",veg,carbohydrates, diabeties goitre, alkaline_diet low_fat_diet low_sodium_diet high_fiber_diet high_protien_diet,20.72
meal_id20,baked multigrain murukku,snacks,"oats, ragi flour (bhakri atta), wheat flour, rice flour, urad dal flour (dry roast and grind the dal to a fine powder), cumin seeds, green chillies, ginger, salt, oil",veg,iron, goitre, low_sodium_diet vegan_diet low_fat_diet high_fiber_diet,22.12
meal_id22,baked namak para,snacks,"whole wheat flour (atta), refined flour (maida), baking powder, ghee, salt, carom seeds (ajwain)",veg,magnesium, goitre, low_sodium_diet high_protien_diet low_fat_diet high_fiber_diet,38.92
meal_id61,crunchy vegetable dal sattu croquettes,dal,"red lentils or masoor dal (half-boiled), potato (grated), carrot, french beans, bread slices, ground chickpea flour (sattu), green chillies, ginger, onions, garlic (minced), salt, sugar, chaat masala, red chilli powder, garam masala, corn flour, besan, bread crumbs for crunchyness, coriander, refined oil (for fryingp)",veg,iron, obesity scurvy kidney_disease heart_disease, low_fat_diet low_sodium_diet gluten_free_diet vegan_diet high_fiber_diet high_protien_diet,29.68
meal_id42,sugar free modak,modak,"seedless dates, almonds, cashew nuts, walnuts, raisins, dry coconut, poppy seeds, ghee",veg,carbohydrates, pregnancy hypertension cancer heart_disease goitre kidney_disease obesity diabeties, low_fat_diet ketogenic_diet gluten_free_diet vegan_diet high_fiber_diet hormone_diet high_protien_diet dash_diet,22.68
meal_id43,beetroot modak,modak,"gram flour (besan), semolina (rava/sooji), beetroot colour or two oven cooked beetroot paste , water, oil (for frying), for sugar syrup:, sugar, water, cardamom powder, lemon juice, cashews (kaju)",veg,selenium, hypertension, vegan_diet low_fat_diet ketogenic_diet,19.04
meal_id62,active charcoal modak,modak,"for modak:, gram flour (besan), semolina (rava/suji), active charcoal, water, oil (for frying), sugar, water, cardamom powder, lemon juice, cashews (kaju)",veg,selenium, obesity diabeties, vegan_diet low_fat_diet ketogenic_diet hormone_diet,17.64
meal_id63,flax seed and beetroot modak,modak,"rice flour, salt, oil (for greasing), beetroot puree, tossed flax seeds (for topping), fresh coconut, jaggery, poppy seeds, green cardamom powder, nutmeg powder",veg,magnesium, goitre hypertension heart_disease, high_protien_diet vegan_diet high_fiber_diet,23.52
meal_id1,summer squash salad,salad,"white balsamic vinegar, lemon juice, lemon rind, red chillies, garlic cloves (crushed), olive oil, summer squash (zucchini), sea salt, black pepper, basil leaves",veg,fiber, obesity diabeties hypertension goitre, alkaline_diet low_fat_diet ketogenic_diet low_sodium_diet high_fiber_diet high_protien_diet dash_diet,27.44
meal_id64,chocolate prunes gujiyas,chocolate,"for gujiya pastry:, refined flour, ghee, water, salt, for gujiya stuffing:, dark chocolate, prunes, mawa, sugar, cardamom",veg,magnesium, hypertension heart_disease, high_protien_diet high_fiber_diet ketogenic_diet,32.2
meal_id65,almond &amp; white chocolate gujiya,gujiya,"all-purpose flour, clarified butter (ghee), water, white chocolate, dessicated coconut, green cardamom powder, almond, jaggery",veg,magnesium, anemia hypertension scurvy heart_disease rickets kidney_disease obesity, low_fat_diet omni_diet ketogenic_diet gluten_free_diet high_fiber_diet hormone_diet high_protien_diet,31.36
meal_id66,betel nut popsicle,sauce,"full cream milk, cream, mascarpone, sugar, paan (crushed), cookie crumble, dark chocolate (melted), caramel sauce",veg,magnesium, hypertension, ketogenic_diet vegan_diet high_fiber_diet high_protien_diet dash_diet,16.8
meal_id4,tricolour salad,salad,"vinegar, honey/sugar, soy sauce, salt, garlic cloves (minced), chilli pepper (sliced), green papaya, carrot (peeled), cucumbers, mint leaves, toasted peanuts",veg,fiber, obesity goitre hypertension, low_fat_diet ketogenic_diet low_sodium_diet high_fiber_diet high_protien_diet,30.52
meal_id49,christmas tree pizza,pizza,"pizza dough (2 boules), red pepper, red onion, basil pesto (purchased, homemade or vegan pesto), mozzarella cheese, kosher salt",veg,chloride, goitre, vegan_diet high_fiber_diet,11.76
meal_id67,clotted cottage cheese croquettes,cheese,"black pepper, black salt, bread crumb, corn flour, refined oil, jalapeno, jeera powder, maida, cottage cheese, parsley, salt, for thousand island dressing:, mayonnaise, tomato ketchup, minced garlic, celery, black pepper",veg,calcium, obesity eye_disease, alkaline_diet low_fat_diet ketogenic_diet vegan_diet high_protien_diet dash_diet,11.76
meal_id68,gajar halwa tart,halwa,"white butter, breakfast sugar, milk full fat, refined flour, winter carrots, ghee, sugar, khoya, cardamom powder, cashew nuts (crushed), almonds (crushed), full fat milk, full fat milk, grain sugar, green cardamom powder",veg,vitamin_d, kidney_disease, low_fat_diet,26.32
meal_id5,gluten-free christmas cake,cake,"christmas dry fruits (pre-soaked), orange zest, lemon zest, jaggery syrup, almond flour, apple, butter (softened), eggs",veg,vitamin_a, goitre kidney_disease, high_protien_diet,20.72
meal_id6,japanese curry arancini with  barley salsa,barley,"japanese curry, sticky rice, cheese inside rice, barley salsa, wasabi mayo, red capsicum cube (cut), yellow capsicum cube (cut), green capsicum cube (cut), green chily, barley, butter, white pepper, light soya, salt",veg,calcium, goitre, high_protien_diet vegan_diet low_fat_diet ketogenic_diet,21.28
meal_id9,cream of almond soup,soup,"vegetable stock, skimmed milk, toasted almonds (powdered), butter, flour, salt and pepper, nutmeg, almond essence, toasted almond flakes",veg,calcium, obesity cancer hypertension, alkaline_diet low_fat_diet ketogenic_diet gluten_free_diet vegan_diet high_protien_diet,35.84
meal_id10,broccoli and almond soup,soup,"vegetable stock, broccoli, ground almonds (toasted), skimmed milk, salt, freshly ground black pepper",veg,vitamin_c, pregnancy hypertension scurvy obesity diabeties, alkaline_diet ketogenic_diet gluten_free_diet vegan_diet high_protien_diet dash_diet,27.44
meal_id72,dark night,apple,"whisky, honey, cinnamon, star anise, cloves, green apple",veg,iron, anemia hypertension scurvy heart_disease eye_disease rickets, vegan_diet low_fat_diet high_fiber_diet ketogenic_diet,32.76
meal_id73,hot chocolate,chocolate,"milk, chocolate, cocoa powder, powdered sugar, cinnamon, vanilla",veg,magnesium, hypertension cancer scurvy heart_disease goitre, high_protien_diet high_fiber_diet ketogenic_diet,11.48
meal_id74,slow cooked spiced sangria,sangria,"red wine (merlot / zinfandel), apple cider, honey, orange (zested and juiced), cloves (whole), green cardamom, cinnamon sticks, anise (whole), brandy",veg,iron, anemia pregnancy scurvy heart_disease goitre kidney_disease obesity diabeties, vegan_diet low_fat_diet high_fiber_diet ketogenic_diet,31.36
meal_id75,detox haldi tea,tea,"haldi, ginger, black pepper, honey, water",veg,manganese, heart_disease, low_fat_diet ketogenic_diet vegan_diet high_fiber_diet hormone_diet,12.88
meal_id76,holi special ice tea thandai,tea,"ground white pepper (kali mirch), assam tea bags, almonds (badam) - coarsley crushed, poppy seeds (khus-khus), fennel seeds (saunf) (crushed coarsely), cardamom (elaichi) powder, ground sugar, saffron (kesar) strands",veg,calcium, kidney_disease heart_disease, low_fat_diet ketogenic_diet vegan_diet hormone_diet high_protien_diet,34.72
meal_id77,grilled lemon margarita,margarita,"vanilla infused tequila, vanilla liqueur, lemon juice, lemon, lemon",veg,vitamin_c, scurvy goitre, vegan_diet,22.96
meal_id78,spanish artichoke and spinach dip,dip,"spinach, onion, cream, garlic, nutmeg, salt, lime juice, artichoke hearts (cubed), polenta, refined flour, salt, water, butter, flour, salt, pepper (freshly ground)",veg,vitamin_c, anemia scurvy kidney_disease, dash_diet high_fiber_diet type_a_diet ketogenic_diet,23.8
meal_id79,beetroot and green apple soup,soup,"beetroots, green apple, onion, olive oil, salt, black peppercorns (crushed), butter, vegetable stock, mixed dried herbs, fresh cream, lemon juice, parsley sprigs, red chilli flakes, soup sticks as required",veg,sodium, anemia pregnancy hypertension scurvy heart_disease goitre kidney_disease obesity diabeties, alkaline_diet high_fiber_diet hormone_diet high_protien_diet dash_diet,19.04
