Meal_Id,Name,catagory,description,Veg_Non,Nutrient,Disease,Diet,Price
meal_id80,baba budan no. 7,cardamom,"rum, espresso, sugar syrup/gur (jaggery) syrup, green cardamom pod,",veg,iron, eye_disease rickets heart_disease scurvy, low_fat_diet ketogenic_diet vegan_diet high_fiber_diet hormone_diet,22.68
meal_id81,fruit infused tea,tea,"chamomile tea bags, orange, berries, blueberries, ginger, mint leaves, boiling water",veg,manganese, pregnancy hypertension scurvy heart_disease eye_disease obesity diabeties, low_fat_diet ketogenic_diet vegan_diet high_fiber_diet hormone_diet high_protien_diet,38.08
meal_id46,steam bunny chicken bao,chicken,"buns, all purpose white flour, dry yeast, sugar, salt, warm water, chicken mince, eggs, soy sauce, sugar, sesame oil, worcestershire sauce, chives, aromat powder",non-veg,iron, anemia rickets goitre kidney_disease pregnancy, low_fat_diet low_carb_diet vegan_diet high_fiber_diet hormone_diet high_protien_diet type_a_diet,19.04
meal_id47,meat lovers pizza,chicken,"millet flour, tapioca flour, soy milk, garlic powder, baking powder, salt, tomato sauce, mozzarella cheese, prosciutto, pepperoni, chicken salami, salami milano, rosemary, olive oil",non-veg,potassium, anemia pregnancy cancer goitre kidney_disease obesity, type_o_diet low_fat_diet omni_diet ketogenic_diet low_sodium_diet vegan_diet high_fiber_diet high_protien_diet dash_diet,28.28
meal_id85,garlic and pinenut soup with burnt butter essence,soup,"garlic cloves, almonds (whole), parsley, bayleaf, chicken broth, nutmeg, egg yolk, heavy cream, white bread slices, butter, salt, pepper, white wine",non-veg,vitamin_a, hypertension cancer heart_disease kidney_disease obesity diabeties, alkaline_diet low_fat_diet ketogenic_diet low_sodium_diet dash_diet type_a_diet,31.64
meal_id86,roast turkey with cranberry sauce,chicken,"whole turkey, butter, onion, celery, crumbled sage and thyme , salt and pepper, garlic minced, balsamic vinegar, sugar, cranberry",non-veg,chloride, goitre, high_protien_diet,35.28
meal_id52,chicken parmigiana with tomato sauce,chicken,"for chicken parmigiana:, chicken breast, egg whole frozen, flour, planko bread crumbs, fresh italian parsley, vegetable oil, solid butter unsalted, tomato sauce, mozzarella cheese, italian parmesan cheese, thyme, for pepperonata:, red pepper, green pepper, yellow pepper, red onion, fresh tomato, butternut squash, garlic, pure olive oil, vegetable oil, black pepper corn (crushed), salt, parsley, for garnishing:, parsley sprig, spinach",non-veg,vitamin_c, anemia rickets goitre kidney_disease pregnancy, low_fat_diet low_carb_diet vegan_diet hormone_diet high_protien_diet type_a_diet,17.64
meal_id87,roasted spring chicken with root veggies,chicken,"whole chicken, thyme, garlic, lemon, orange, salt, black pepper, butter (to rub), extra olive oil, carrot, turnip, beetroot, chipotle powder, parsley",non-veg,iron, anemia pregnancy hypertension rickets goitre kidney_disease obesity, alkaline_diet low_fat_diet low_carb_diet ketogenic_diet vegan_diet high_fiber_diet hormone_diet high_protien_diet type_a_diet,36.12
meal_id88,peri peri chicken satay,chicken,"boneless skinless chicken thigh (trimmed), salt and pepper, yogurt, chilli powder, ginger garlic paste, coriander leaves, oil to fry, peri peri sauce, potato fries",non-veg,chloride, anemia rickets goitre kidney_disease pregnancy, low_fat_diet low_carb_diet vegan_diet hormone_diet high_protien_diet type_a_diet,28.0
meal_id89,chicken popcorn,chicken,"chicken (boneless), corn flour or all purpose flour, egg, bread crumbs, salt, ginger garlic paste, black pepper, onion powder (optional), red chilli powder or paprika or cayenne pepper, oil for deep frying",non-veg,iron, anemia rickets goitre kidney_disease pregnancy, low_fat_diet low_carb_diet low_sodium_diet vegan_diet high_fiber_diet hormone_diet high_protien_diet dash_diet type_a_diet,33.6
meal_id56,chocolate samosa,chicken,"refined flour, desi ghee, black cardamom seeds, chocolate block, almonds, cashew nuts, pistachio, sugar, garam masala powder, oil",non-veg,magnesium, hypertension heart_disease, high_protien_diet high_fiber_diet ketogenic_diet,32.480000000000004
meal_id90,half roast chicken,chicken,"cooking oil, whole chicken (skin on- rinsed and dressed), onions (quartered- skin on), garlic (halved - skin on), carrots (roughly quartered), celery , thyme, dunkleweizen (pour into a glass and keep open at room temperature for an hour or two to make flat), chicken stock, butter, sea salt",non-veg,vitamin_a, anemia pregnancy scurvy heart_disease rickets goitre kidney_disease obesity diabeties, low_fat_diet low_carb_diet ketogenic_diet vegan_diet high_fiber_diet hormone_diet high_protien_diet type_a_diet,31.080000000000002
meal_id91,riceless chicken biryani,chicken,"malabar peppercorn, cinnamon stick, green cardamom pods, star anise, cloves, fennel seeds, vermicelli, desi ghee, shahi jeera, bay leaves, green chilli, mint leaves, onion, saffron, garlic paste, salt, chicken (dark meat), ginger paste, turmeric powder, coriander powder, red chilli powder, roma tomatoes (de-seedeed), water",non-veg,vitamin_c, anemia rickets goitre kidney_disease pregnancy, low_fat_diet low_carb_diet vegan_diet hormone_diet high_protien_diet type_a_diet,20.16
meal_id92,chicken farcha,chicken,"boneless chicken thigh (without skin), lemon juice, garlic paste, ginger paste, red chilli powder, coriander powder, garam masala, black pepper (crushed), salt, bread crumbs / semolina, eggs, red chilli powder, oil",non-veg,iron, anemia rickets goitre kidney_disease pregnancy, low_fat_diet low_carb_diet vegan_diet high_fiber_diet hormone_diet high_protien_diet type_a_diet,19.6
meal_id93,buldak (hot and spicy chicken),chicken,"chicken drum sticks/ chicken breast, soy sauce, sugar, traditional corn syrup (substitution honey), cheong ju (clear rice wine similar to japanese  sake), green onion, black pepper, olive oil, sesame seeds (optional), for marinating sauce:, gochugaru (red chili pepper flakes), alapenos, korean pear (substitution asian pear), onion, garlic, soy sauce, spicy yellow mustard, sesame oil, sugar, mul yut (substitution honey)",non-veg,magnesium, obesity, high_protien_diet high_fiber_diet,30.52
meal_id95,steamed chicken roulade,chicken,"lamb mince, garlic , salt, paprika powder, pomodaro tomatoes, olive oil, celery, shallots, carrot, black pepper, bay leaf, yellow chilli powder, cilantro, chicken thigh, salt, white pepper powder, garlic paste, white wine vinegar, olive oil, yellow chilli powder, refined oil, fenugreek seeds, white pepper powder, garlic, fenugreek leaves, onion, broken cashew, salt, fresh cream, kasoori methi",non-veg,iron, anemia scurvy rickets goitre kidney_disease pregnancy, low_fat_diet low_carb_diet vegan_diet high_fiber_diet hormone_diet high_protien_diet type_a_diet,13.16
meal_id96,methi chicken masala,chicken,"boneless chicken, lemon juice, red chilli powder, salt, ginger garlic paste, curd, red chilli powder, salt, coriander powder, oil, onion, oil, bay leaf, green cardamom, black cardamom, cinnamon, ginger garlic paste, tomato, kasoori methi, green chilli, water",non-veg,iron, anemia rickets goitre kidney_disease pregnancy, low_fat_diet low_carb_diet vegan_diet high_fiber_diet hormone_diet high_protien_diet type_a_diet,20.16
meal_id97,restaurant style fried chicken,chicken,"egg, salt, white pepper, maida, salt, red chilli powder, garlic powder, ginger powder, onion powder, oregano, chillil flakes, white pepper, basil, chicken drumsticks, salt, white pepper, bread crumbs (as required)",non-veg,iron, anemia cancer rickets goitre kidney_disease pregnancy, alkaline_diet low_fat_diet low_carb_diet vegan_diet high_fiber_diet hormone_diet high_protien_diet type_a_diet,22.12
meal_id98,chicken potli,chicken,"chicken, onion, green chilli, garlic, ginger, salt, aromatic powder, soya sauce, oyster sauce, spring onion, filo sheets",non-veg,iron, anemia rickets goitre kidney_disease pregnancy, low_fat_diet low_carb_diet vegan_diet high_fiber_diet hormone_diet high_protien_diet type_a_diet,21.0
meal_id99,spicy chicken masala,chicken,"mustard oil, curry leaves, kalonjee, saunf, garlic, onion, tomatoes, ginger, green chillies, boneless chicken, salt, tomato puree, red chilli powder, cumin powder, black salt, peppercorn (crushed), water, mint, coriander",non-veg,iron, anemia pregnancy rickets goitre kidney_disease obesity, low_fat_diet low_carb_diet vegan_diet high_fiber_diet hormone_diet high_protien_diet type_a_diet,23.8
meal_id100,spicy chicken curry,chicken,"oil, ghee, onion paste, garlic paste, ginger paste, turmeric powder, salt, tomato puree, coriander powder, red chilli powder, cumin powder, garam masala, chicken leg pieces, coriander leaves, water",non-veg,iron, anemia pregnancy rickets goitre kidney_disease obesity, low_fat_diet low_carb_diet vegan_diet high_fiber_diet hormone_diet high_protien_diet type_a_diet,37.52
meal_id101,crispy herb chicken,chicken,"fresh breadcrumbs, parmesan cheese, lemon rind, fresh parsley leaves, garlic powder, plain flour, egg, milk, chicken breast supremes, vegetable oil, mayonnaise, sour cream, fresh chives (dried if fresh not available), fresh parsley (dried if fresh not available), garlic, red onion (optional), ground black pepper, salt",non-veg,chloride, anemia rickets goitre kidney_disease pregnancy diabeties, low_fat_diet low_carb_diet vegan_diet hormone_diet high_protien_diet type_a_diet,22.400000000000002
meal_id102,dahi chicken,chicken,"dahi, cumin powder, garlic paste, garam masala, turmeric powder, red chilli powder, salt, boneless chicken, oil, green chilli, onion, tomato",non-veg,iron, anemia rickets goitre kidney_disease pregnancy, low_fat_diet low_carb_diet vegan_diet high_fiber_diet hormone_diet high_protien_diet type_a_diet,21.0
meal_id103,amritsari chicken masala,chicken,"chicken, ginger garlic paste, curd, lemon juice, vinegar, coriander powder, cumin powder, red chilli powder, salt, onion, butter, red chilli powder, coriander powder, cumin powder, ginger, water, salt, green chilli, tomatoes, sugar, butter , cream",non-veg,iron, anemia rickets goitre kidney_disease pregnancy, low_fat_diet low_carb_diet vegan_diet high_fiber_diet hormone_diet high_protien_diet type_a_diet,36.96
meal_id104,chilli chicken,chicken,"boneless chicken, salt, cornflour, black pepper, egg, soy sauce, red chilli sauce, garlic, green chillies, green chilli sauce, vinegar, onion, capsicum, black pepper, salt",non-veg,chloride, anemia rickets goitre kidney_disease pregnancy, low_fat_diet low_carb_diet vegan_diet hormone_diet high_protien_diet type_a_diet,21.84
meal_id105,oat crusted chicken tenders,chicken,"chicken breast (cut into strips), salt, garlic paste, ginger paste, green chilli paste, oats, refined flour, salt, freshly ground black pepper, fried mixed herbs (italian herb), garlic powder",non-veg,iron, anemia rickets goitre kidney_disease pregnancy, low_fat_diet low_carb_diet vegan_diet high_fiber_diet hormone_diet high_protien_diet type_a_diet,14.56
meal_id106,chicken nimbu dhaniya shorba,chicken,"water, chicken (diced)), ginger garlic paste, coriander, lemon, cream, butter, turmeric powder, green chilli paste, cornflour, salt",non-veg,chloride, anemia rickets goitre kidney_disease pregnancy, low_fat_diet low_carb_diet vegan_diet hormone_diet high_protien_diet type_a_diet,19.32
meal_id58,dahi lasooni chicken,chicken,"chicken (boneless, cube size), chesse, garlic, ginger garlic paste, coriander, green chilli paste, cream (fresh), curd, kaju paste, salt, black salt , garam masala, chaat masala, butter",non-veg,chloride, anemia rickets goitre kidney_disease pregnancy, low_fat_diet low_carb_diet vegan_diet hormone_diet high_protien_diet type_a_diet,13.44
meal_id107,garlic soya chicken,chicken,"chicken thigh/breast (cut crosswise into 1/2-inch-thin strips), sesame oil (toasted), white pepper (finely ground), ginger juice, peanut oil or vegetable oil (divided), garlic cloves (minced), ginger, red chilli flakes, red onion , snow peas (trimmed), red bell pepper (cut into thin strips), rice vinegar, soy sauce, dark soy sauce, chinese rice wine, brown sugar, cornflour",non-veg,iron, anemia hypertension cancer heart_disease rickets goitre kidney_disease pregnancy diabeties, alkaline_diet low_fat_diet low_carb_diet vegan_diet high_fiber_diet hormone_diet high_protien_diet dash_diet type_a_diet,14.56
meal_id108,cauliflower and chicken biryani,chicken,"boneless chicken, biryani masala, yogurt, onions, coconut oil, cauliflower, coconut (diced), onion (diced), peppercorns, cardamoms, cumin seeds, bay leaves, cinnamon, cloves, coconut oil, garam masala, dry chilli flakes, turmeric powder, black peppercorns, cardamom, cinnamon, garlic (crushed), tomato puree, green chillies, fresh ginger (peeled), dry red chilli, salt",non-veg,chloride, anemia cancer rickets goitre kidney_disease pregnancy, low_fat_diet low_carb_diet ketogenic_diet vegan_diet hormone_diet high_protien_diet dash_diet type_a_diet,21.28
meal_id109,chicken quinoa biryani,chicken,"onions, tomato, green chillies(slit open), ginger garlic paste, mint leaves, coriander leaves/cilantro, fresh yogurt/curd(beaten), turmeric powder, chilli powder, salt, chicken (cut into pieces), garam masala powder, ginger garlic paste, yogurt/curd,  chilli powder, coriander powder, salt, oil, cloves, bay leaf , cardamom",non-veg,iron, anemia rickets goitre kidney_disease pregnancy, low_fat_diet low_carb_diet low_sodium_diet vegan_diet high_fiber_diet hormone_diet high_protien_diet dash_diet type_a_diet,23.52
meal_id110,chicken and mushroom lasagna,chicken,"chicken, salt, crush black pepper, garlic cloves (minced), olive oil, fresh thyme, button mushroom, onion, low fat milk, basil, basil-tomato sauce",non-veg,iron, anemia rickets goitre kidney_disease pregnancy, low_fat_diet low_carb_diet vegan_diet high_fiber_diet hormone_diet high_protien_diet type_a_diet,37.52
meal_id111,plum and cherry roasted chicken,chicken,"carrot (finely diced), onion (finely diced), celery (finely diced), fresh thyme sprigs, whole free range chicken , pepper (freshly ground), parsley stems, celery leaves, lemon slices (1/8 inch thick), onion, carrot, fresh lemon juice, chicken stock/broth, plums (cut), fresh cherries",non-veg,iron, anemia hypertension scurvy rickets goitre kidney_disease pregnancy, alkaline_diet low_fat_diet low_carb_diet vegan_diet high_fiber_diet hormone_diet high_protien_diet type_a_diet,18.76
meal_id112,chicken roulade,chicken,"chicken breasts, olives, jalapenos, bell peppers(all 3), thyme dried, white wine, salt, black pepper (crushed to taste), egg, olive oil, mozerella cheese, processed cheese",non-veg,calcium, anemia rickets goitre kidney_disease pregnancy, low_fat_diet low_carb_diet ketogenic_diet vegan_diet hormone_diet high_protien_diet type_a_diet,37.24
meal_id113,sticky rum chicken wings,chicken,"chicken wings without skin, hung curd, chilli powder, sweet paprika powder, english mustard paste, garlic paste, salt, garlic, rum, bbq sauce",non-veg,iron, anemia rickets goitre kidney_disease pregnancy, low_fat_diet low_carb_diet vegan_diet high_fiber_diet hormone_diet high_protien_diet type_a_diet,37.52
meal_id126,andhra crab meat masala,meat,"processed crab meat, refined oil, curry leaves, garlic, green chilli, onion, ginger-garlic paste, coriander, coriander powder, cumin powder, turmeric powder, garam masala powder, kashmiri chilli powder, salt, lemon, chop masala, tomato",non-veg,potassium, anemia pregnancy cancer kidney_disease obesity, type_o_diet low_fat_diet omni_diet ketogenic_diet low_sodium_diet vegan_diet high_fiber_diet high_protien_diet dash_diet,28.84
meal_id47,meat lovers pizza,meat,"millet flour, tapioca flour, soy milk, garlic powder, baking powder, salt, tomato sauce, mozzarella cheese, prosciutto, pepperoni, chicken salami, salami milano, rosemary, olive oil",non-veg,potassium, anemia pregnancy cancer goitre kidney_disease obesity, type_o_diet low_fat_diet omni_diet ketogenic_diet low_sodium_diet vegan_diet high_fiber_diet high_protien_diet dash_diet,21.0
meal_id127,cajun spiced turkey wrapped with bacon,meat,"turkey breast, cajun spice, spinach leaves (cooked and drained), garlic pods, salted butter, feta cheese, bacon strips, ground black pepper, for cajun spice:, onion powder, garlic powder, seasoning salt, paprika, ground black pepper, cayenne pepper, oregano, thyme, red pepper flakes (if you like it spicy))",non-veg,vitamin_c, cancer, high_protien_diet,31.080000000000002
meal_id8,lamb and chargrilled bell pepper soup,soup,"lamb bones (preferably shank and shoulder), onions, celery, ginger, garlic, carrot, chargrilled red/yellow/green bell peppers (quartered), whole spices mix (black pepper, cinnamon, cardamom, clove, bay leaf), salt, water (warm), oil (sunflower or olive",non-veg,sodium, pregnancy scurvy goitre kidney_disease obesity, alkaline_diet,17.64
meal_id128,mongolian lamb balls,meat,"lamb (minced), couscous, scallion, garlic, egg, parsley, olive oil, mint, ao nori herb, salt, five spice, cinnamon powder",non-veg,iron, goitre, vegan_diet low_fat_diet high_fiber_diet,36.68
meal_id129,oyster lamb,meat,"vegetable oil, garlic, ginger, lamb, stock, oyster sauce, dry sherry, sugar, celery, salt, bokchoy, shitake mushroom",non-veg,iron, goitre, vegan_diet low_fat_diet high_fiber_diet,34.44
meal_id130,chicken shami kebab,meat,"oil, cumin seeds, cloves, black peppercorns, cinnamon, coriander seeds, ajwain, red chilli whole, chilli flakes, boneless chicken, salt, water, ginger, green chilli, garlic, coriander leaves , mint leaves , egg",non-veg,phosphorus, anemia rickets goitre kidney_disease pregnancy, low_fat_diet low_carb_diet vegan_diet high_fiber_diet hormone_diet high_protien_diet type_a_diet,36.4
meal_id131,balti meat,meat,"refined oil, black cardamoms, green cardamoms, mace, clove, cinnamon stick, black pepper corn, ginger garlic paste, ginger, green chilies, mutton curry cut, brown onion paste, salt, kashmiri red chili powder, tomato puree, garam masala powder, coriander powder, cumin powder",non-veg,potassium, anemia pregnancy cancer kidney_disease obesity, type_o_diet low_fat_diet omni_diet ketogenic_diet low_sodium_diet vegan_diet high_fiber_diet high_protien_diet dash_diet,15.4
meal_id132,coffee marinated mutton chops,coffee,"mutton chops, espresso, honey, balsamic vinegar, rosemary, pink peppercorns (crushed), olive oil, salt",non-veg,chloride, pregnancy anemia, ketogenic_diet hormone_diet,18.76
meal_id133,sali boti (parsi meat dish),meat,"mutton (wash and cut into very small cubes), ghee or oil, tomatoes, onions, green chillies, coriander leaves, chilli powder, turmeric powder, ginger-garlic paste, water, vinegar, jaggery, salt, potatoes, oil",non-veg,potassium, anemia pregnancy cancer kidney_disease obesity, type_o_diet low_fat_diet omni_diet ketogenic_diet low_sodium_diet vegan_diet high_fiber_diet high_protien_diet dash_diet,14.56
meal_id44,andhra pan fried pomfret,curry,"white pomfret fish, sunflower refined ooil, red chilli powder, salt, turmeric powder, ginger-garlic paste, lemon (juiced), cumin powder, coriander powder, garam masala, green chilli, curry leaves, coriander",veg,iron, cancer, alkaline_diet low_fat_diet vegan_diet high_fiber_diet hormone_diet,13.72
meal_id136,malabari fish curry,curry,"sear fish, coconut, ginger, pureed tamarind, salt, powdered turmeric, green chillies, red chilli powder, shallots",non-veg,vitamin_a, anemia pregnancy hypertension cancer heart_disease rickets goitre kidney_disease obesity diabeties, alkaline_diet low_fat_diet ketogenic_diet vegan_diet high_protien_diet dash_diet low_carb_diet,22.68
meal_id137,portugese fish stew,fish,"sole fillet (you can also do 2/3 types of fish), large shrimps (optional), potatoes (peeled), onions (cut into slices), garlic cloves, red capsicum (can use green also), parsley or coriander (choose the herb that most suits your taste buds), few dashes of hot sauce, paprika, olive oil, white wine, rock salt",non-veg,vitamin_a, anemia pregnancy hypertension cancer heart_disease rickets goitre kidney_disease obesity diabeties, alkaline_diet low_fat_diet ketogenic_diet vegan_diet high_protien_diet dash_diet low_carb_diet,25.48
meal_id138,malabar fish curry,curry,"whole coriander seeds, whole red chilli, coconut oil, mustard seeds, onion, curry leaf, coconut milk, tamarind pulp, coriander, seabass fish curry cuts",non-veg,vitamin_a, anemia pregnancy hypertension cancer heart_disease rickets goitre kidney_disease obesity diabeties, alkaline_diet low_fat_diet ketogenic_diet vegan_diet high_protien_diet dash_diet low_carb_diet,28.560000000000002
meal_id139,surmai curry with lobster butter rice,rice,"tamarind, red chilli powder, turmeric powder, salt, fresh coconut, onion, garlic cloves, coriander seeds, fenugreek seeds, red chilli powder, turmeric powder, tamarind (lemon sized), butter, lobster (de-shell and devein and make a small cube), salt and lime, surmai",veg,chloride, obesity diabeties anemia, low_sodium_diet vegan_diet dash_diet ketogenic_diet,24.92
meal_id140,seared salmon in tabasco butter,butter,"butter, tabasco, chives, salt, salmon fillet, olive oil, sea salt",non-veg,calcium, anemia pregnancy hypertension heart_disease rickets goitre obesity diabeties, low_fat_diet ketogenic_diet low_sodium_diet vegan_diet high_protien_diet,14.84
meal_id141,"risotto lobster with parmesan egg pancake, confit tomatoes and coral tuille",egg,"lobster shell, carrot, leeks, garlic cloves, tomato paste, bay leaf, peppercorn, water, lobster meat, arborio rice, onion, leeks, lobster stock, parmesan cheese, cream, salt, olive oil, egg, parmesan, flour, milk, parsley, salt, cherry tomatoes, garlic pods, olive oil, water, oil, flour, salt",non-veg,vitamin_c, hypertension cancer heart_disease rickets goitre kidney_disease pregnancy diabeties, low_fat_diet ketogenic_diet low_sodium_diet high_fiber_diet high_protien_diet dash_diet,25.48
meal_id142,fish skewers with coriander and red wine vinegar dressing,wine,"sea bass fillets, olive oil (for grilling), red wine vinegar, sugar, extra virgin olive oil, garlic clove, coriander, bamboo skewers",non-veg,vitamin_a, anemia pregnancy hypertension cancer scurvy heart_disease rickets goitre kidney_disease obesity diabeties, alkaline_diet low_fat_diet ketogenic_diet low_sodium_diet vegan_diet high_protien_diet dash_diet low_carb_diet,37.24
meal_id143,seafood rock filler,baked,"baked tart of mixed sea food served with phyllo fruit bowl, savory tart shell (semi baked), mixed sea food, mornay sauce, assorted herb and seasoning, phyllo pastry, assorted seasonal fruit",veg,iodine, anemia pregnancy rickets goitre obesity, type_o_diet omni_diet ketogenic_diet vegan_diet dash_diet,24.92
meal_id144,shrimp &amp; cilantro ceviche,coriander,"prawns, gherkin, onion, cilantro, mix bell pepper, tiger milk, sweet corn, sea salt, black pepper, green lemon juice, cherry tomato, edible flower, coriander stems, celery stalks, garlic, ginger, red onion, lemon juice, sea salt, black pepper",veg,vitamin_a, anemia goitre, ketogenic_diet,16.8
meal_id145,saewoo bokumbop (shrimp fried rice),egg,"cooked rice, shrimp (de-veined, onion, cooked green peas, green onion, egg (scrambled), vegetable oil/butter, soy sauce, sesame oil, salt, pepper",veg,vitamin_a, cancer, alkaline_diet hormone_diet,12.32
meal_id146,goan prawn curry &amp; baked rice canapes,rice,"jeera whole, coriander seeds, kashmiri chilly, garlic, ginger, green chillies, kokum, coconut, onion, tomatoes, coriander, prawns, salt, turmeric powder, garlic paste, asafoetida, refined oil, ginger paste, goan rice, coconut milk, green chillies, fresh coconut, hing, refined oil, coriander leaves, basmati rice, coconut milk, green chillies, coconut milk, coconut, salt, green chillies, curry leaf, lecite",veg,iron, obesity diabeties goitre anemia, low_fat_diet ketogenic_diet low_sodium_diet vegan_diet high_fiber_diet dash_diet,30.8
meal_id147,bihari fish curry,curry,"rohu fish, salt, turmeric powder, chilli powder, oil, garlic , green chillies, mustard seeds, black peppercorns, cumin seeds, whole red chillies, fenugreek seeds, tomatoes, mustard oil, bay leaves, water, garam masala, coriander leaves",non-veg,vitamin_a, anemia pregnancy hypertension cancer heart_disease rickets goitre kidney_disease obesity diabeties, alkaline_diet low_fat_diet ketogenic_diet vegan_diet high_protien_diet dash_diet low_carb_diet,12.32
meal_id57,fish with jamun sauce,sauce,"jamun, sugar, chilli, garlic cloves (minced), cumin (powdered), fish fillet (pomfret (or any white fish), semolina, salt, wilted spinach",non-veg,vitamin_c, anemia pregnancy hypertension cancer heart_disease rickets goitre kidney_disease obesity diabeties, alkaline_diet low_fat_diet ketogenic_diet vegan_diet high_protien_diet dash_diet low_carb_diet,31.36
meal_id148,beer batter fish fingers,fish,"river sole fish (cut in thin strips), garlic paste, salt , lime juice, beer, flour, cornflour, white pepper, eggs, mustard",non-veg,vitamin_a, anemia pregnancy hypertension cancer heart_disease rickets goitre kidney_disease obesity diabeties, alkaline_diet low_fat_diet ketogenic_diet gluten_free_diet vegan_diet high_protien_diet dash_diet low_carb_diet,35.56
meal_id149,prawn and litchi salad,salad,"prawns (shelled and cleaned), spring onions, mango flesh, litchis (deseeded), chilli flakes, lemon (for lemon juice), olive oil, peanuts (to garnish), salt",veg,fiber, obesity goitre hypertension, low_fat_diet ketogenic_diet low_sodium_diet high_fiber_diet high_protien_diet,21.56
